{
  "schema_version": 1,
  "registry_id": "jarvis-future-vm-controller-operations",
  "version": "1.0.0",
  "implementation_status": "contract_only",
  "execution_enabled": false,
  "operations": [
    {
      "id": "profile.enrollment.prepare",
      "revision": "1.0.0",
      "category": "profile",
      "effect_class": "none",
      "availability": "contract_simulation_only",
      "execution_enabled": false,
      "requires_approval": false,
      "allowed_parameters": ["proposal_id", "proposal_digest"],
      "identity_bindings": ["policy_digest", "proposal_digest"],
      "from_states": ["defined"],
      "to_state": "prepared",
      "future_adapter": null
    },
    {
      "id": "profile.enrollment.authorize",
      "revision": "1.0.0",
      "category": "profile",
      "effect_class": "authority_record",
      "availability": "unimplemented",
      "execution_enabled": false,
      "requires_approval": true,
      "allowed_parameters": ["proposal_id", "proposal_digest", "consent_scope"],
      "identity_bindings": ["policy_digest", "proposal_digest", "approval_digest"],
      "from_states": ["prepared"],
      "to_state": "authorized",
      "future_adapter": "future.enrollment.authority-store"
    },
    {
      "id": "profile.observe.registered",
      "revision": "1.0.0",
      "category": "profile",
      "effect_class": "host_read",
      "availability": "unimplemented",
      "execution_enabled": false,
      "requires_approval": true,
      "allowed_parameters": ["proposal_id", "group_ids", "fact_ids", "observation_limits"],
      "identity_bindings": ["policy_digest", "proposal_digest", "approval_digest", "host_binding_digest"],
      "from_states": ["authorized"],
      "to_state": "in_progress",
      "future_adapter": "future.registered-observation-broker"
    },
    {
      "id": "profile.observation.stop",
      "revision": "1.0.0",
      "category": "profile",
      "effect_class": "control",
      "availability": "unimplemented",
      "execution_enabled": false,
      "requires_approval": false,
      "allowed_parameters": ["run_id", "reason"],
      "identity_bindings": ["policy_digest", "run_digest"],
      "from_states": ["in_progress"],
      "to_state": "stopped",
      "future_adapter": "future.registered-observation-broker"
    },
    {
      "id": "profile.candidate.finalize",
      "revision": "1.0.0",
      "category": "profile",
      "effect_class": "evidence_record",
      "availability": "unimplemented",
      "execution_enabled": false,
      "requires_approval": false,
      "allowed_parameters": ["run_id", "evidence_digest", "unknown_fact_ids"],
      "identity_bindings": ["policy_digest", "run_digest", "evidence_digest"],
      "from_states": ["in_progress", "stopped"],
      "to_state": "evidence_pending_review",
      "future_adapter": "future.profile-candidate-builder"
    },
    {
      "id": "profile.candidate.review",
      "revision": "1.0.0",
      "category": "profile",
      "effect_class": "authority_record",
      "availability": "unimplemented",
      "execution_enabled": false,
      "requires_approval": true,
      "allowed_parameters": ["candidate_digest", "accepted_fact_ids", "rejected_fact_ids"],
      "identity_bindings": ["policy_digest", "candidate_digest", "approval_digest"],
      "from_states": ["evidence_pending_review"],
      "to_state": "completed",
      "future_adapter": "future.profile-review-store"
    },
    {
      "id": "image.metadata.resolve",
      "revision": "1.0.0",
      "category": "image",
      "effect_class": "network_read",
      "availability": "unimplemented",
      "execution_enabled": false,
      "requires_approval": true,
      "allowed_parameters": ["release_policy", "architecture", "official_domains"],
      "identity_bindings": ["policy_digest", "request_digest"],
      "from_states": ["defined"],
      "to_state": "prepared",
      "future_adapter": "future.official-fedora-metadata"
    },
    {
      "id": "image.acquire",
      "revision": "1.0.0",
      "category": "image",
      "effect_class": "network_and_disk_write",
      "availability": "unimplemented",
      "execution_enabled": false,
      "requires_approval": true,
      "allowed_parameters": ["image_lock_digest", "destination_object_id", "maximum_bytes"],
      "identity_bindings": ["policy_digest", "image_lock_digest", "approval_digest"],
      "from_states": ["prepared"],
      "to_state": "in_progress",
      "future_adapter": "future.official-image-acquirer"
    },
    {
      "id": "image.verify",
      "revision": "1.0.0",
      "category": "image",
      "effect_class": "evidence_record",
      "availability": "unimplemented",
      "execution_enabled": false,
      "requires_approval": false,
      "allowed_parameters": ["image_lock_digest", "acquired_object_id"],
      "identity_bindings": ["policy_digest", "image_lock_digest", "object_digest"],
      "from_states": ["in_progress"],
      "to_state": "completed",
      "future_adapter": "future.image-verifier"
    },
    {
      "id": "domain.plan",
      "revision": "1.0.0",
      "category": "domain",
      "effect_class": "none",
      "availability": "unimplemented",
      "execution_enabled": false,
      "requires_approval": false,
      "allowed_parameters": ["profile_digest", "image_lock_digest", "isolation_policy_digest"],
      "identity_bindings": ["policy_digest", "profile_digest", "image_lock_digest"],
      "from_states": ["defined"],
      "to_state": "prepared",
      "future_adapter": "future.domain-planner"
    },
    {
      "id": "baseline.create",
      "revision": "1.0.0",
      "category": "baseline",
      "effect_class": "disk_write_and_guest_lifecycle",
      "availability": "unimplemented",
      "execution_enabled": false,
      "requires_approval": true,
      "allowed_parameters": ["domain_digest", "image_lock_digest", "maximum_bytes"],
      "identity_bindings": ["policy_digest", "domain_digest", "image_lock_digest", "approval_digest"],
      "from_states": ["prepared"],
      "to_state": "in_progress",
      "future_adapter": "future.baseline-provisioner"
    },
    {
      "id": "baseline.attest",
      "revision": "1.0.0",
      "category": "baseline",
      "effect_class": "evidence_record",
      "availability": "unimplemented",
      "execution_enabled": false,
      "requires_approval": false,
      "allowed_parameters": ["baseline_object_id", "domain_digest", "clean_shutdown_evidence"],
      "identity_bindings": ["policy_digest", "baseline_digest", "domain_digest"],
      "from_states": ["in_progress"],
      "to_state": "completed",
      "future_adapter": "future.outside-guest-attestor"
    },
    {
      "id": "overlay.create",
      "revision": "1.0.0",
      "category": "scenario",
      "effect_class": "disk_write",
      "availability": "unimplemented",
      "execution_enabled": false,
      "requires_approval": true,
      "allowed_parameters": ["baseline_digest", "scenario_id", "maximum_bytes"],
      "identity_bindings": ["policy_digest", "baseline_digest", "scenario_digest", "approval_digest"],
      "from_states": ["prepared"],
      "to_state": "in_progress",
      "future_adapter": "future.overlay-manager"
    },
    {
      "id": "scenario.start",
      "revision": "1.0.0",
      "category": "scenario",
      "effect_class": "guest_lifecycle",
      "availability": "unimplemented",
      "execution_enabled": false,
      "requires_approval": true,
      "allowed_parameters": ["overlay_digest", "scenario_id", "timeout_seconds", "output_limit_bytes"],
      "identity_bindings": ["policy_digest", "domain_digest", "overlay_digest", "scenario_digest", "approval_digest"],
      "from_states": ["prepared"],
      "to_state": "in_progress",
      "future_adapter": "future.scenario-runner"
    },
    {
      "id": "scenario.cancel",
      "revision": "1.0.0",
      "category": "scenario",
      "effect_class": "guest_lifecycle",
      "availability": "unimplemented",
      "execution_enabled": false,
      "requires_approval": false,
      "allowed_parameters": ["run_id", "reason"],
      "identity_bindings": ["policy_digest", "run_digest"],
      "from_states": ["in_progress"],
      "to_state": "stopped",
      "future_adapter": "future.scenario-runner"
    },
    {
      "id": "evidence.export",
      "revision": "1.0.0",
      "category": "scenario",
      "effect_class": "bounded_data_transfer",
      "availability": "unimplemented",
      "execution_enabled": false,
      "requires_approval": false,
      "allowed_parameters": ["run_id", "evidence_manifest_digest", "maximum_bytes"],
      "identity_bindings": ["policy_digest", "run_digest", "evidence_manifest_digest"],
      "from_states": ["in_progress", "stopped"],
      "to_state": "evidence_pending_review",
      "future_adapter": "future.evidence-exporter"
    },
    {
      "id": "overlay.dispose",
      "revision": "1.0.0",
      "category": "scenario",
      "effect_class": "bounded_delete",
      "availability": "unimplemented",
      "execution_enabled": false,
      "requires_approval": true,
      "allowed_parameters": ["overlay_object_id", "overlay_digest", "run_id"],
      "identity_bindings": ["policy_digest", "overlay_digest", "run_digest", "approval_digest"],
      "from_states": ["evidence_pending_review", "failed", "stopped"],
      "to_state": "reset_pending",
      "future_adapter": "future.overlay-manager"
    },
    {
      "id": "baseline.reverify",
      "revision": "1.0.0",
      "category": "scenario",
      "effect_class": "evidence_record",
      "availability": "unimplemented",
      "execution_enabled": false,
      "requires_approval": false,
      "allowed_parameters": ["baseline_object_id", "expected_baseline_digest", "run_id"],
      "identity_bindings": ["policy_digest", "baseline_digest", "run_digest"],
      "from_states": ["reset_pending"],
      "to_state": "reset_verified",
      "future_adapter": "future.outside-guest-attestor"
    }
  ]
}
